{
  "schema_version": 1,
  "classification": "ENERGY_DECISION_LOG",
  "mode": "READ_ONLY",
  "generated_at": "2026-10-01T12:00:00+02:00",
  "entry_count": 7,
  "entries": [
    {
      "id": "EDL-2026-10-01-001",
      "recorded_at": "2026-10-01T12:00:00+02:00",
      "entry_kind": "MEASUREMENT_CONCLUSION",
      "scenario_id": "shadow_bill_scenario_a",
      "title": "Scenario A is retrospectief goedkoper",
      "inputs": {
        "evidence_refs": [
          "docs/evidence/SHADOW_BILL_SCENARIO_A_2025-06_TO_2026-05.md",
          "docs/evidence/shadow-bill-scenario-a-2025-06-01_2026-06-01.json"
        ],
        "data_classification": "PRIVACY_SAFE_DERIVED_EVIDENCE"
      },
      "constraints": {
        "read_only": true,
        "physical_writes_allowed": false,
        "contract_change_allowed": false,
        "production_automation_allowed": false
      },
      "reason": "Dezelfde 35.040 Fluvius-kwartieren zijn met de gevalideerde dynamische formule tegen de gereconcilieerde jaarfactuur vergeleken.",
      "proposed_action": {
        "type": "RECONCILE_BEFORE_CONTRACT_DECISION",
        "summary": "Behoud de uitkomst als backtest en rond de historische componentreconciliatie af voordat een contractadvies wordt gegeven.",
        "production_command": null,
        "setpoint": null
      },
      "confidence": {
        "level": "HIGH",
        "score": 0.95,
        "basis": "Volledig factuurjaar, volledige prijsdekking en gereconcilieerde import- en exportvolumes."
      },
      "outcome": {
        "status": "VERIFIED",
        "summary": "Dynamisch is in de gevalideerde jaarbacktest lager, zonder gedragswijziging.",
        "metrics": {
          "difference_eur_incl_vat": -246.086518222,
          "energy_interval_count": 35040,
          "missing_price_interval_count": 0
        }
      },
      "reproduction": {
        "script": "scripts/shadow_bill_scenario_a.py",
        "arguments": [
          "--help"
        ]
      }
    },
    {
      "id": "EDL-2026-10-01-002",
      "recorded_at": "2026-10-01T12:00:00+02:00",
      "entry_kind": "MEASUREMENT_CONCLUSION",
      "scenario_id": "three_year_energy_trend",
      "title": "Netafhankelijkheid is over drie jaar gestegen",
      "inputs": {
        "evidence_refs": [
          "docs/evidence/MULTIYEAR_ENERGY_BATTERY_COMPARISON_2023-10_TO_2026-09.md",
          "docs/evidence/multiyear-energy-battery-summary-2023-10-01_2026-10-01.json"
        ],
        "data_classification": "PRIVACY_SAFE_DERIVED_EVIDENCE"
      },
      "constraints": {
        "read_only": true,
        "physical_writes_allowed": false,
        "contract_change_allowed": false,
        "production_automation_allowed": false
      },
      "reason": "De drie volledige lokale Fluvius-jaren tonen meer afname, minder injectie en een hogere afnamegewogen marktprijs.",
      "proposed_action": {
        "type": "PRIORITIZE_SOFTWARE_SCENARIOS",
        "summary": "Prioriteer contract- en softwarematige optimalisatie boven extra hardware.",
        "production_command": null,
        "setpoint": null
      },
      "confidence": {
        "level": "HIGH",
        "score": 0.94,
        "basis": "105.216 kwartieren zijn gekoppeld; zes onbeschikbare kwartieren blijven expliciet zichtbaar."
      },
      "outcome": {
        "status": "VERIFIED",
        "summary": "Het laatste jaar is sterker afhankelijk van netafname dan het eerste jaar.",
        "metrics": {
          "import_change_percent": 21.6062,
          "export_change_percent": -32.785595,
          "unavailable_interval_count": 6
        }
      },
      "reproduction": {
        "script": "scripts/analyze_multiyear_energy_battery.py",
        "arguments": [
          "--help"
        ]
      }
    },
    {
      "id": "EDL-2026-10-01-003",
      "recorded_at": "2026-10-01T12:00:00+02:00",
      "entry_kind": "SIMULATION_DECISION",
      "scenario_id": "peak_neutral_winter_grid_charging",
      "title": "Winterse piekneutrale netlading eerst shadow-testen",
      "inputs": {
        "evidence_refs": [
          "docs/evidence/SCENARIO_OPTIONS_OVERVIEW_2023-10_TO_2026-09.md",
          "docs/evidence/multiyear-energy-battery-summary-2023-10-01_2026-10-01.json"
        ],
        "data_classification": "PRIVACY_SAFE_DERIVED_EVIDENCE"
      },
      "constraints": {
        "read_only": true,
        "physical_writes_allowed": false,
        "contract_change_allowed": false,
        "production_automation_allowed": false
      },
      "reason": "De perfecte piekneutrale bovengrens is positief, terwijl extra hardware niet nodig is.",
      "proposed_action": {
        "type": "BUILD_OFFLINE_SHADOW_CONTROLLER",
        "summary": "Bouw een offline Day-Ahead-shadowplanning met forecastfouten en zonder apparaatwrites.",
        "production_command": null,
        "setpoint": null
      },
      "confidence": {
        "level": "MEDIUM",
        "score": 0.64,
        "basis": "Drie volledige jaren zijn doorgerekend, maar de optimizer gebruikt perfecte kennis van prijs en residueel profiel."
      },
      "outcome": {
        "status": "PROPOSED",
        "summary": "Kandidaat voor de volgende read-only simulatie-iteratie.",
        "metrics": {
          "average_value_eur_per_year": 36.860993,
          "winter_value_eur_per_year": 19.692357
        }
      },
      "reproduction": {
        "script": "scripts/analyze_multiyear_energy_battery.py",
        "arguments": [
          "--help"
        ]
      }
    },
    {
      "id": "EDL-2026-10-01-004",
      "recorded_at": "2026-10-01T12:00:00+02:00",
      "entry_kind": "SIMULATION_DECISION",
      "scenario_id": "shared_grid_peak_cap_7kw",
      "title": "7 kW alleen als expliciete gezamenlijke guardrail testen",
      "inputs": {
        "evidence_refs": [
          "docs/evidence/SCENARIO_OPTIONS_OVERVIEW_2023-10_TO_2026-09.md"
        ],
        "data_classification": "PRIVACY_SAFE_DERIVED_EVIDENCE"
      },
      "constraints": {
        "read_only": true,
        "physical_writes_allowed": false,
        "contract_change_allowed": false,
        "production_automation_allowed": false
      },
      "reason": "De 7 kW-grens is de enige onderzochte limiet waarbij prijsbewuste netlading in een jaar nodig was voor peak shaving.",
      "proposed_action": {
        "type": "OFFLINE_GUARDRAIL_TEST",
        "summary": "Test 7 kW naast 8 en 10 kW met expliciete headroom voor huis, warmtepomp, EV en batterijladen.",
        "production_command": null,
        "setpoint": null
      },
      "confidence": {
        "level": "MEDIUM",
        "score": 0.7,
        "basis": "De gezamenlijke Fluvius-kwartierpiek is volledig beschikbaar, maar individuele lasten zijn niet gedesaggregeerd."
      },
      "outcome": {
        "status": "PROPOSED",
        "summary": "Geen productielimiet; uitsluitend een offline guardrail-scenario.",
        "metrics": {
          "historical_quarters_above_cap": 125,
          "maximum_historical_excess_kw": 3.012,
          "average_model_value_eur_per_year": 98.120467
        }
      },
      "reproduction": {
        "script": "scripts/analyze_multiyear_energy_battery.py",
        "arguments": [
          "--help"
        ]
      }
    },
    {
      "id": "EDL-2026-10-01-005",
      "recorded_at": "2026-10-01T12:00:00+02:00",
      "entry_kind": "SIMULATION_DECISION",
      "scenario_id": "additional_battery_capacity",
      "title": "Extra batterijcapaciteit uitstellen",
      "inputs": {
        "evidence_refs": [
          "docs/evidence/MULTIYEAR_ENERGY_BATTERY_COMPARISON_2023-10_TO_2026-09.md",
          "docs/evidence/BATTERY_ARBITRAGE_SIMULATION_2026-01_TO_2026-09.md"
        ],
        "data_classification": "PRIVACY_SAFE_DERIVED_EVIDENCE"
      },
      "constraints": {
        "read_only": true,
        "physical_writes_allowed": false,
        "contract_change_allowed": false,
        "production_automation_allowed": false
      },
      "reason": "De perfecte bovengrens is te klein en de realistische Day-Ahead-test was negatief.",
      "proposed_action": {
        "type": "DEFER_INVESTMENT",
        "summary": "Geen extra batterij adviseren zonder installatiekost, levensduur en positieve realistische forecastsimulatie.",
        "production_command": null,
        "setpoint": null
      },
      "confidence": {
        "level": "MEDIUM",
        "score": 0.83,
        "basis": "Zowel overlap- als driejaarsanalyses wijzen in dezelfde richting, maar hardwarekosten zijn nog niet ingevoerd."
      },
      "outcome": {
        "status": "DEFERRED",
        "summary": "Geen investeringscase ondersteund.",
        "metrics": {
          "perfect_upper_bound_eur_per_year": 84.209486,
          "realistic_overlap_value_eur": -107.734356
        }
      },
      "reproduction": {
        "script": "scripts/simulate_battery_arbitrage.py",
        "arguments": [
          "--help"
        ]
      }
    },
    {
      "id": "EDL-2026-10-01-006",
      "recorded_at": "2026-10-01T12:00:00+02:00",
      "entry_kind": "MEASUREMENT_CONCLUSION",
      "scenario_id": "solcast_daily_forecast_quality",
      "title": "Day-Ahead PV-forecast overschat de korte evaluatieperiode",
      "inputs": {
        "evidence_refs": [
          "docs/evidence/PV_FORECAST_QUALITY_2026-09-24_TO_2026-09-30.md",
          "docs/evidence/pv-forecast-quality-2026-09-24_2026-09-30.json"
        ],
        "data_classification": "PRIVACY_SAFE_DERIVED_EVIDENCE"
      },
      "constraints": {
        "read_only": true,
        "physical_writes_allowed": false,
        "contract_change_allowed": false,
        "production_automation_allowed": false
      },
      "reason": "Zes bewaarde Day-Ahead-dagforecasts zijn tegen afgeleide werkelijke PV-dagenergie beoordeeld, met alle revisies en één retentiegat zichtbaar.",
      "proposed_action": {
        "type": "CALIBRATE_BEFORE_SHADOW_CONTROL",